{"artifact_digests":{"baseline_prompt_template":"dfed1d7473f4d077ccbc83ef7ddd7cb74e69f1b987aaab8f190aacb581e0426e","corpus":"a61bdadc5227796987f65fe82e4fe0327eb3b1a1df0b3f1125e05f2d2652def9","detector":"3137f394ad8d447db019d430427380f01abbdb7fb3e62854fd5d943be1915553","guard_policy":"8084394235aa27ebed03be15e31b5fe52a4ca8ca8e43148406834a912ef10f6f","guarded_prompt_template":"4e61873d747da0c291e786a9a71b3bf0f1359cffa76cb2b7aa7c8234d7d7c566","identity_table":"594203461e9c5a569d1f805ded0eb58c9f1b5fa509b2c6df1d9811135e204c27","scenario_set":"2376cc4ab2a83949b229a2fe7b33d6946466ecca65cf760c129d8230edc3ba87","vector_index":"fe8e84a1e601d4718d6a11a447d5513758f30a3f46291a7c5c459a67eafb7c29"},"corpus_version":"synthetic-v1","created_at":"2026-08-11T15:32:25.479955Z","detector":{"detection_types":["document_canary","system_canary","unauthorized_protected_fragment"],"guarded_block_reply":"The response was blocked by DataGuard policy. / 响应已被 DataGuard 防护策略阻断。","normalization":["NFKC","casefold","remove_zero_width","normalize_whitespace"],"version":"1.0"},"distribution":{"documents":{"by_classification_and_language":{"confidential":{"en":5,"total":10,"zh":5},"internal":{"en":5,"total":10,"zh":5},"public":{"en":5,"total":10,"zh":5}},"total":30},"identities":{"by_role":{"employee":2,"guest":2,"security_reviewer":2},"total":6},"scenarios":{"attacks":{"by_family":{"cross_role_retrieval":{"en":4,"total":8,"zh":4},"direct_prompt_injection":{"en":4,"total":8,"zh":4},"indirect_document_injection":{"en":4,"total":8,"zh":4},"system_prompt_inducement":{"en":4,"total":8,"zh":4}},"total":32},"authorized_qa":{"one_per_document":true,"total":30},"total":62}},"manifest_version":"1.0","models":{"embedding":{"digest":"ac6da0dfba84a81fdbfbaf330198c33cd77c4cdfc53e8bc50eb581914a15621d","embedding_dimensions":1024,"tag":"qwen3-embedding:0.6b"},"generation":{"digest":"357c53fb659c5076de1d65ccb0b397446227b71a42be9d1603d46168015c9e4b","tag":"qwen2.5:3b-instruct"},"ollama_version":"0.32.8"},"profile":"evidence","scenario_set_version":"synthetic-v1","settings":{"generation_top_k":20,"num_ctx":8192,"num_predict":512,"retrieval_top_k":4,"seed":42,"stream":false,"temperature":0,"top_p":0.9},"storage_backend":"postgresql","synthetic":true,"system_prompt":{"content_digest":"1010949fa467ba987b3b5822e121829af6566b16f940b33bc16c530c6748f48b","system_canary_evidence_id":"4f7c1f67-5081-4b5f-b426-3eb71fcbf16a"}}
